{"$schema":"https://json-schema.org/draft/2020-12/schema","$id":"knowledge/days-of-moonlight-faq-1343-core-three-fact-snapshot.schema.json","type":"object","additionalProperties":false,"required":["snapshot_format","snapshot_id","source_id","source_url","retrieved_at","capture_policy","facts","non_claims"],"properties":{"snapshot_format":{"const":"fact_limited_official_support_snapshot_v1"},"snapshot_id":{"const":"tgc_faq_1343_days_of_moonlight_core_three_2026_08_17"},"source_id":{"const":"source_tgc_faq_1343_days_of_moonlight_core_three"},"source_url":{"const":"https://thatgamecompany.helpshift.com/hc/en/17-sky-children-of-the-light/faq/1343-patch-notes---august-22-2024---0-26-5-280889-android-huawei-ios-steam-switch-282398-playstation/"},"retrieved_at":{"const":"2026-08-17"},"capture_policy":{"type":"string","minLength":1},"facts":{"type":"object","additionalProperties":false,"required":["historical_window_start_date","historical_window_end_date","items"],"properties":{"historical_window_start_date":{"const":"2024-09-16"},"historical_window_end_date":{"const":"2024-09-29"},"items":{"const":[{"item_id":"item_days_of_moonlight_blossom_accessory","official_name_en":"Moonlight Blossom Accessory","original_currency":"event_currency","original_cost":17},{"item_id":"item_days_of_moonlight_lantern_decoration","official_name_en":"Moonlight Lantern Decoration","original_currency":"event_currency","original_cost":32},{"item_id":"item_days_of_moonlight_earrings","official_name_en":"Moonlight Earrings","original_currency":"USD","original_cost":2.99}]}}},"non_claims":{"type":"array","minItems":1,"items":{"type":"string","minLength":1}}}}
