{"snapshot_format":"fact_limited_official_support_snapshot_v1","snapshot_id":"tgc_faq_1343_days_of_moonlight_core_three_2026_08_17","source_id":"source_tgc_faq_1343_days_of_moonlight_core_three","source_url":"https://thatgamecompany.helpshift.com/hc/en/17-sky-children-of-the-light/faq/1343-patch-notes---august-22-2024---0-26-5-280889-android-huawei-ios-steam-switch-282398-playstation/","retrieved_at":"2026-08-17","capture_policy":"Structured, fact-limited transcription of the named Days of Moonlight 2024 individual offers and Pacific event window. No HTML, images, storefront state, account data, or full-page text is retained.","facts":{"historical_window_start_date":"2024-09-16","historical_window_end_date":"2024-09-29","items":[{"item_id":"item_days_of_moonlight_blossom_accessory","official_name_en":"Moonlight Blossom Accessory","original_currency":"event_currency","original_cost":17},{"item_id":"item_days_of_moonlight_lantern_decoration","official_name_en":"Moonlight Lantern Decoration","original_currency":"event_currency","original_cost":32},{"item_id":"item_days_of_moonlight_earrings","official_name_en":"Moonlight Earrings","original_currency":"USD","original_cost":2.99}]},"non_claims":["This historical FAQ statement does not establish current storefront availability, permanence, return policy, first release date, or account ownership.","The Moonlight Frock and Updo bundle, Traditional Chinese names, image assets, visual matches, resale prices, and account inventory are excluded."]}
